URL,Score,Keywords Found,type_page,description,headline,datePublished,dateModified,author,byline,excerpt,lang
https://www.bbc.co.uk/sport/africa/63977525,1.2541620421753608,gender-,webpage,"After a slow start to the 2022 World Cup, Africa delivered its best ever result at the tournament in Qatar.",World Cup 2022: Six things Africa learned at historic finals,2022-12-19T16:24:49.000Z,2022-12-19T16:24:49.000Z,Nigel Bidmead,Nigel Bidmead,"After a slow start to the 2022 World Cup, Africa delivered its best ever result at the tournament in Qatar.",en-GB
https://www.bbc.co.uk/sport/football/articles/c623y5ye6kpo,1,gender-,webpage,"United States striker Alex Morgan says an emotional goodbye to professional football, as the two-time World Cup winner plays her final game in the National Women's Soccer League. ",Alex Morgan: United States legend plays final game after announcing retirement,2024-09-09T07:06:59.401Z,2024-09-09T07:06:59.401Z,BBC Sport,BBC Sport,"United States striker Alex Morgan says an emotional goodbye to professional football, as the two-time World Cup winner plays her final game in the National Women's Soccer League.",en-GB
https://www.bbc.co.uk/iplayer/episodes/p0df24z1/planet-sex-with-cara-delevingne,6.653932584269663,gender-,webpage,"Hold on to your seats - its a wild ride through sex. Cara Delevingne gets hands-on, travelling the world to explore gender, sexuality and our deepest desires.",Planet Sex with Cara Delevingne - BBC iPlayer,,,,,"Hold on to your seats - it's a wild ride through sex. Cara Delevingne gets hands-on, travelling the world to explore gender, sexuality and our deepest desires.",en-GB
https://www.bbc.co.uk/sport/football/64032536,14.146845915201656,gender-,webpage,"With Leah Williamson the latest female player to suffer an ACL injury, BBC Sport takes a look at the issue.",Leah Williamson: Why are so many female footballers suffering ACL injuries?,2022-12-21T14:02:54.000Z,2023-04-21T14:16:38.000Z,Katie Wright,Katie Wright,"With Leah Williamson the latest female player to suffer an ACL injury, BBC Sport takes a look at the issue.",en-GB
https://www.bbc.co.uk/sport/football/66645961,1,gender-,webpage,It should have been a time of great celebration for Spain but a historic Women's World Cup win has been overshadowed by a sexism scandal.,Luis Rubiales: The kiss that shook Spanish and global football,2023-09-01T12:09:12.000Z,2023-09-10T20:51:26.000Z,Katie Falkingham,Katie Falkingham,It should have been a time of great celebration for Spain but a historic Women's World Cup win has been overshadowed by a sexism scandal.,en-GB
https://www.bbc.co.uk/news/world-europe-66775437,3.1972209771402955,gender-,webpage,The World Cup victors look to have eventually won this particular battle over consent and gender equality.,Luis Rubiales resignation a win for Spain's women's team - BBC News,,,,Guy Hedgecoe,The World Cup victors look to have eventually won this particular battle over consent and gender equality.,en-GB
https://www.bbc.co.uk/sport/africa/59134904,1,gender-,webpage,"The Women's African Champions League, which starts on Friday, is the ""best move ever"", says Vihiga Queens captain Enez Mango.",Women's African Champions League creation is the 'best move ever',2021-11-04T17:28:44.000Z,2021-11-04T17:28:44.000Z,BBC Sport,BBC Sport,"The Women's African Champions League, which starts on Friday, is the ""best move ever"", says Vihiga Queens captain Enez Mango.",en-GB
https://www.bbc.co.uk/sport/football/62389997#comments,1,gender-,webpage,"Improving attendances and tackling inequalities over pay, prize money, coverage and sponsorship will be no quick-fix, reports BBC sports editor Dan Roan.",How can England's Euro 2022 win help grow the game?,2022-08-02T07:52:00.000Z,2022-08-02T12:06:45.000Z,Dan Roan,Dan Roan,"Improving attendances and tackling inequalities over pay, prize money, coverage and sponsorship will be no quick-fix, reports BBC sports editor Dan Roan.",en-GB
https://www.bbc.co.uk/sport/football/62389997,1,gender-,webpage,"Improving attendances and tackling inequalities over pay, prize money, coverage and sponsorship will be no quick-fix, reports BBC sports editor Dan Roan.",How can England's Euro 2022 win help grow the game?,2022-08-02T07:52:00.000Z,2022-08-02T12:06:45.000Z,Dan Roan,Dan Roan,"Improving attendances and tackling inequalities over pay, prize money, coverage and sponsorship will be no quick-fix, reports BBC sports editor Dan Roan.",en-GB
https://www.bbc.co.uk/news/world-europe-55324417,7,"transgender, gender-",webpage,"A new law says only married couples can adopt, with some exceptions for single relatives.",Hungary bans same-sex couples from adopting children - BBC News,,,,BBC News,"A new law says only married couples can adopt, with some exceptions for single relatives.",en-GB
https://www.bbc.co.uk/programmes/p03w9v9m,1.7982740021574972,gender-,webpage,Listen to and download our programmes,"BBC World Service - Sporting Witness, Olympic history",,,,,Listen to and download our programmes,en-GB
https://www.bbc.co.uk/programmes/p00j2pn5/episodes/downloads,1.5688599348534202,transgender,webpage,Podcast downloads for Sporting Witness,BBC World Service - Sporting Witness - Downloads,,,,,Podcast downloads for Sporting Witness,en-GB
https://www.bbc.co.uk/sport/extra/fnyzo8vcuz/how-city-of-light-changed-the-olympics,1,gender-,webpage,,How City of Light changed the Olympics,,,,,Paris 1924,
https://www.bbc.co.uk/news/uk-43715079,1,gender-,webpage,Commonwealth leaders will be coming from all over the world to attend King Charles' Coronation.,"Which countries are in the Commonwealth, and what is it for? - BBC News",,,,BBC News,Commonwealth leaders will be coming from all over the world to attend King Charles' Coronation.,en-GB
https://www.bbc.co.uk/sport/commonwealth-games/62479810,1.3975208993946382,intersex,webpage,Olympic diving champion Tom Daley talks to BBC Sport about his LGBT+ manifesto for the Commonwealth Games.,Tom Daley: Olympic champion says Commonwealth Games LGBT+ manifesto is 'first step',2022-08-09T14:19:09.000Z,2022-08-09T14:19:09.000Z,Ciaran Varley,Ciaran Varley,Olympic diving champion Tom Daley talks to BBC Sport about his LGBT+ manifesto for the Commonwealth Games.,en-GB
https://www.bbc.co.uk/programmes/m0021hvm,1,gender-,webpage,All the pods you need to enjoy an Olympic sporting summer.,BBC - Summer of Sport,,,,,All the pods you need to enjoy an Olympic sporting summer.,en-GB
https://www.bbc.co.uk/sport/athletics/22269445,3,"sex change, gender-",webpage,BBC Radio 5 live special investigates the legacy of East Germany's widespread athletics doping,East Germany athletes were 'chemical field tests',2013-04-23T16:41:33.000Z,2013-04-23T16:41:33.000Z,Mike Costello,Mike Costello,BBC Radio 5 live special investigates the legacy of East Germany's widespread athletics doping,en-GB
https://www.bbc.co.uk/sport/olympics/articles/c74lx7kxpj4o,1.3392437126831915,gender-,webpage,"Tom Cruise descends from the Stade de France roof as stars of sport, screen and music bring Paris 2024 to a spectacular conclusion.",Paris Olympics closing ceremony: 2024 Games end at Stade de France,2024-08-11T22:37:35.774Z,2024-08-11T23:05:24.081Z,Phil Cartwright,Phil Cartwright,"Tom Cruise descends from the Stade de France roof as stars of sport, screen and music bring Paris 2024 to a spectacular conclusion.",en-GB
https://www.bbc.co.uk/news/business-65478376,3,gender-,webpage,Governments in the region are spending hundreds of billions of dollars trying to reverse the trend.,Asia is spending big to battle low birth rates - will it work? - BBC News,,,,Mariko Oi,Governments in the region are spending hundreds of billions of dollars trying to reverse the trend.,en-GB
https://www.bbc.co.uk/news/articles/c17g1re092eo,8.808757940262197,"non binary, gender-, trans people",webpage,Slam Dunk festival was criticised for releasing a line-up with only two acts featuring women. ,Female and non-binary acts 'sick' of being overlooked on line-ups - BBC News,,,,Riyah Collins,Slam Dunk festival was criticised for releasing a line-up with only two acts featuring women.,en-GB
https://www.bbc.co.uk/news/articles/c903d09jwk7o,1,"gender-, gender identity",webpage,There are measures to nationalise rail operators and speed up house building in Labour's first legislative programme since returning to power.,King's Speech: Keir Starmer pledges growth but warns of 'no quick fix' - BBC News,,,,Kate Whannel,There are measures to nationalise rail operators and speed up house building in Labour's first legislative programme since returning to power.,en-GB
https://www.bbc.co.uk/news/world-asia-68672318,7.638103919781221,"gender-, transgender, gender identity",webpage,Thailand's lower house has passed a bill giving legal recognition to same-sex marriage.,Thailand moves to legalise same-sex marriage - BBC News,,,,Jonathan Head & Kelly Ng,Thailand's lower house has passed a bill giving legal recognition to same-sex marriage.,en-GB
https://www.bbc.co.uk/sounds/play/p0h3rp55,2,puberty blockers,webpage,"Catch up on your favourite BBC radio show from your favourite DJ right here, whenever you like. Listen without limits with BBC Sounds.","The Story - An unsolved murder, the Troubles, and the British state - BBC Sounds",,,,,Will a long awaited investigation finally reveal any answers?,en-GB
https://www.bbc.co.uk/news/uk-scotland-north-east-orkney-shetland-43555968,1,gender-,webpage,The new body aims to promote the language with the goal of making it more visible in everyday life.,North-East language board set up to promote Doric - BBC News,,,,BBC News,The new body aims to promote the language with the goal of making it more visible in everyday life.,en-GB
https://www.bbc.co.uk/news/articles/cd1j8dvw73lo,3.016608570842731,transgender,webpage,The Republican presidential candidate is forging new alliances as his campaign gains momentum.,Why tech bros are backing Trump - BBC News,,,,Natalie Sherman,The Republican presidential candidate is forging new alliances as his campaign gains momentum.,en-GB
https://www.bbc.co.uk/sounds/play/m001nppp,1,gender-,webpage,"Catch up on your favourite BBC radio show from your favourite DJ right here, whenever you like. Listen without limits with BBC Sounds.","Understand - Tech and AI - Tech and AI: 4. Cryptocurrency, Blockchain and the Web version 3.0 - BBC Sounds",,,,,"Is cryptocurrency dodgy? What is blockchain, and what have they got do do with Web 3.0?",en-GB
https://www.bbc.co.uk/news/articles/cz5r2mk18k1o,1.489285179079874,gender-,webpage,"Norway's oil wealth has made it one of the world's richest countries, but some feel bad about it.",Norway's oil brings wealth but for some a sense of guilt - BBC News,,,,Jorn Madslien,"Norway's oil wealth has made it one of the world's richest countries, but some feel bad about it.",en-GB
https://www.bbc.co.uk/news/technology-63033078,2,non binary,webpage,Apple chief executive tells the BBC the tech sector needs more women in order to thrive.,Tim Cook: 'No good excuse' for lack of women in tech - BBC News,,,,Zoe Kleinman,Apple chief executive tells the BBC the tech sector needs more women in order to thrive.,en-GB
https://www.bbc.co.uk/news/topics/cmj0p0zy06et,1.0987124463519313,gender-,webpage,All the latest content about Women in technology from the BBC.,Women in technology - BBC News,,,,,All the latest content about Women in technology from the BBC.,en-GB
https://www.bbc.co.uk/news/uk-england-london-58665603,1.8641087906750853,"gender-based, gender-",webpage,Safety tips for women continue to suggest murderers have an excuse for killing.,Sabina Nessa killing: Does following the 'rules' keep women safe? - BBC News,,,,Bethan Bell,Safety tips for women continue to suggest murderers have an excuse for killing.,en-GB
https://www.bbc.co.uk/news/uk-wales-57445053,8.319374874774594,"gender-neutral, gender-",webpage,Until now men who have sex with men had to wait three months before donating.,Blood donation: Gay couple 'thrilled' after rules change - BBC News,,,,BBC News,Until now men who have sex with men had to wait three months before donating.,en-GB
https://www.bbc.co.uk/news/articles/c990pywzynzo,1.6468820435762586,gender-,webpage,Rebecca Openshaw-Rowe and Georgina Gilbert - the Antarctic Fire Angels - did the trek in 52 days.,South Pole walk firefighters aim to inspire other women - BBC News,,,,India Pollock,Rebecca Openshaw-Rowe and Georgina Gilbert - the Antarctic Fire Angels - did the trek in 52 days.,en-GB
https://www.bbc.co.uk/news/uk-wales-67478210,0.1886399166232413,gender-,webpage,Georgina Gilbert and Rebecca Openshaw-Rowe aim to finish the 777-mile expedition in just 50 days.,South Wales firefighters hope Antarctica trek empowers girls - BBC News,,,,Stephen Fairclough,Georgina Gilbert and Rebecca Openshaw-Rowe aim to finish the 777-mile expedition in just 50 days.,en-GB
https://www.bbc.co.uk/cymrufyw/37834474,1,tranny,webpage,Y 'siaradwr Cymraeg' ddaeth o fewn trwch blewyn i fod yn Arlywydd America,Y Cymro fu bron yn Arlywydd - BBC Cymru Fyw,,,,BBC Cymru Fyw,Y 'siaradwr Cymraeg' ddaeth o fewn trwch blewyn i fod yn Arlywydd America,cy
https://www.bbc.co.uk/cymrufyw/erthyglau/cvg52ym06ndo,1,tranny,webpage,"Yn ôl Estyn, mae effaith negyddol y pandemig ar safonau darllen Cymraeg plant i'w weld yn glir o hyd.",Disgyblion yn 'colli'r hyder i ddarllen a chyfathrebu yn Gymraeg' - BBC Cymru Fyw,,,,Bethan Lewis,"Yn ôl Estyn, mae effaith negyddol y pandemig ar safonau darllen Cymraeg plant i'w weld yn glir o hyd.",cy
https://www.bbc.co.uk/sport/rugby-union/67617370,4.594279546681058,gender-,webpage,The Welsh Rugby Union has revamped the 12-strong board that runs the national game.,Welsh rugby: Who sits on the WRU board?,2023-12-06T13:06:39.000Z,2023-12-06T13:06:39.000Z,Matt Lloyd,Matt Lloyd,The Welsh Rugby Union has revamped the 12-strong board that runs the national game.,en-GB
https://www.bbc.co.uk/news/entertainment-arts-61552233,0.040464503771100446,gender-,webpage,The outcome of the High Court libel case between Rebekah Vardy and Coleen Rooney is due on Friday.,Wagatha Christie case: The possible outcomes as judgement to be published - BBC News,,,,Paul Glynn,The outcome of the High Court libel case between Rebekah Vardy and Coleen Rooney is due on Friday.,en-GB
https://www.bbc.co.uk/news/entertainment-arts-61506895,1,gender-,webpage,Rebekah Vardy's libel case against Coleen Rooney is on its final day in London's High Court.,Rebekah Vardy is 'highly unreliable witness' says Coleen Rooney's lawyer - BBC News,,,,Paul Glynn,Rebekah Vardy's libel case against Coleen Rooney is on its final day in London's High Court.,en-GB
https://www.bbc.co.uk/news/entertainment-arts-61458158,3,gender-,webpage,Coleen Rooney finished giving evidence on day five of a libel case brought by Rebekah Vardy.,Coleen Rooney says texts between Vardy and agent were evil - BBC News,,,,Paul Glynn,Coleen Rooney finished giving evidence on day five of a libel case brought by Rebekah Vardy.,en-GB
https://www.bbc.co.uk/news/entertainment-arts-56363640,1,"gender-neutral, gender-",webpage,It is also a record year for diversity in the acting nominations and for female directors.,"Oscars nominations 2021: Brits, diversity and female directors rewarded - BBC News",,,,BBC News,It is also a record year for diversity in the acting nominations and for female directors.,en-GB
https://www.bbc.co.uk/news/entertainment-arts-56363640#comments,1,"gender-neutral, gender-",webpage,It is also a record year for diversity in the acting nominations and for female directors.,"Oscars nominations 2021: Brits, diversity and female directors rewarded - BBC News",,,,BBC News,It is also a record year for diversity in the acting nominations and for female directors.,en-GB
https://www.bbc.co.uk/news/entertainment-arts-52632475,1.580371724084299,gender-,webpage,Theatre bosses say social distancing will be difficult – so can they stay afloat until it ends?,'We're clinging on' - theatre leaders discuss lockdown turmoil - BBC News,,,,Ian Youngs,Theatre bosses say social distancing will be difficult – so can they stay afloat until it ends?,en-GB
https://www.bbc.co.uk/news/entertainment-arts-62966638,2.10462837328509,non binary,webpage,"The TV hit has spawned a dance show, which creator Steven Knight hopes will attract new audiences.",Peaky Blinders dance show: 'Anyone who likes Strictly can love this' - BBC News,,,,Emma Saunders,"The TV hit has spawned a dance show, which creator Steven Knight hopes will attract new audiences.",en-GB
https://www.bbc.co.uk/news/newsbeat-66818092,21.655172413793103,"trans community, transgender, trans woman",webpage,Ella Morgan Clark will be the first trans woman to walk down the aisle on Married At First Sight.,"Married At First Sight cast just saw me as Ella, says trans bride - BBC News",,,,Riyah Collins,Ella Morgan Clark will be the first trans woman to walk down the aisle on Married At First Sight.,en-GB
https://www.bbc.co.uk/news/articles/c88z1y40205o,4.449593884376493,"transgender, trans woman",webpage,"Becky, who was on show First Dates, shares her dating experiences as a Trans woman.",First Dates star Becky on dating as a trans woman - BBC News,,,,BBC News,"Becky, who was on show First Dates, shares her dating experiences as a Trans woman.",en-GB
https://www.bbc.co.uk/sounds/play/w3ct6nwx,1,transgender,webpage,"Catch up on your favourite BBC radio show from your favourite DJ right here, whenever you like. Listen without limits with BBC Sounds.",Dear Daughter - The dating to-do list - BBC Sounds,,,,,Wen is raised believing sex is taboo but knows she must change for her daughter’s sake,en-GB
https://www.bbc.co.uk/news/entertainment-arts-50593751,1.6552442695068303,gender-,webpage,Timothee Chalamet and Imelda Staunton will be among the star attractions in the next 12 months.,The theatre shows you won't want to miss in 2020 - BBC News,,,,Ian Youngs,Timothee Chalamet and Imelda Staunton will be among the star attractions in the next 12 months.,en-GB
https://www.bbc.co.uk/news/blogs-trending-49149441,1,gender-,webpage,Celeste Labedz's picture of herself dressed up as a princess while on a field trip researching glaciers has become a viral hit.,What's a 'Science Princess' doing in an ice field in Alaska? - BBC News,,,,Dhruti Shah,Celeste Labedz's picture of herself dressed up as a princess while on a field trip researching glaciers has become a viral hit.,en-GB
https://www.bbc.co.uk/news/articles/cd9dxkw70qqo,2,"gender-, gender identity",webpage,"Superfans were told guests will go ""on a journey through the African savanna"" alongside a growing Simba. ",Disney Parks announces Lion King ride for Disneyland Paris - BBC News,,,,Lucy Clarke-Billings,"Superfans were told guests will go ""on a journey through the African savanna"" alongside a growing Simba.",en-GB
https://www.bbc.co.uk/programmes/p0982621,2.579234972677596,"gender-, gender identity",webpage,LGBT: 'So important for the community to be counted',"BBC One - North West Tonight, 'So important for LGBT community to be counted'",,,,,LGBT: 'So important for the community to be counted',en-GB
https://www.bbc.co.uk/programmes/p095jjbr,8.216232053911515,"gender-, transgender, gender identity",webpage,"LGBTQ+  stories about identity, exploration and togetherness in England.",BBC - LGBTQ+ Life,,,,,"LGBTQ+  stories about identity, exploration and togetherness in England.",en-GB
https://www.bbc.co.uk/news/world-us-canada-53783257,1,transgender,webpage,The legendary country singer has been reticent to share her political beliefs in the past.,Dolly Parton: 'Of course black lives matter!' - BBC News,,,,BBC News,The legendary country singer has been reticent to share her political beliefs in the past.,en-GB
https://www.bbc.co.uk/news/stories,0.5875968992248062,transgender,webpage,All the latest content about Stories from the BBC.,Stories - BBC News,,,,,All the latest content about Stories from the BBC.,en-GB
https://www.bbc.co.uk/news/topics/ck5r705zl3xt,1,gender-,webpage,All the latest content about Pigeons from the BBC.,Pigeons - BBC News,,,,,All the latest content about Pigeons from the BBC.,en-GB
https://www.bbc.co.uk/news/uk-scotland-glasgow-west-63584376,1,gender-,webpage,"Glasgow City Council will make payments to 19,000 claimants in a deal with unions and campaigners.",Glasgow City Council to pay £770m to settle equal pay dispute - BBC News,,,,BBC News,"Glasgow City Council will make payments to 19,000 claimants in a deal with unions and campaigners.",en-GB
https://www.bbc.co.uk/news/uk-england-south-yorkshire-66888018,1,gender-,webpage,Union members claim female council workers have been discriminated against for years.,Sheffield City Council hit by thousands of equal pay claims - BBC News,,,,"Lucy Ashton, Victoria Scheer and Dave Higgens",Union members claim female council workers have been discriminated against for years.,en-GB
https://www.bbc.co.uk/news/uk-england-tyne-66795656,1,gender-,webpage,"Sunderland City Council says it is ""very happy"" to try to resolve the dispute with GMB members.",Care workers accuse Sunderland council of pay discrimination - BBC News,,,,BBC News,"Sunderland City Council says it is ""very happy"" to try to resolve the dispute with GMB members.",en-GB
https://www.bbc.co.uk/news/topics/c7zz9w14znpt,2.186868686868687,non binary,webpage,All the latest content about Statues and sculptures from the BBC.,Statues and sculptures - BBC News,,,,,All the latest content about Statues and sculptures from the BBC.,en-GB
https://www.bbc.co.uk/news/articles/c1rwp7y23dlo,1,gender-,webpage,"Platinum House is described as an ""inspirational project"" at the Constructing Excellence awards. ",Horsham: New training centre and fire station wins award - BBC News,,,,Stuart Maisner,"Platinum House is described as an ""inspirational project"" at the Constructing Excellence awards.",en-GB
https://www.bbc.co.uk/news/articles/cvgdw700pwdo,1.2071197411003236,gender-,webpage,A blue-coloured pigeon mystifying locals was among our most read stories this week.,Weekly round-up: Five stories you may have missed - BBC News,,,,BBC News,A blue-coloured pigeon mystifying locals was among our most read stories this week.,en-GB
https://www.bbc.co.uk/news/topics/c4e713newp7t,1,gender-,webpage,All the latest content about Peterborough Council from the BBC.,Peterborough Council - BBC News,,,,,All the latest content about Peterborough Council from the BBC.,en-GB
https://www.bbc.co.uk/news/world-europe-guernsey-16091614,1,gender-,webpage,Plans to house workers during the Guernsey Airport redevelopment project are unanimously approved by the Environment Department.,Guernsey Airport project workers housing approved - BBC News,,,,BBC News,Plans to house workers during the Guernsey Airport redevelopment project are unanimously approved by the Environment Department.,en-GB
https://www.bbc.co.uk/programmes/p0fldpds,2.25629546726357,"gender-, gender identity",webpage,"Rylan talks to male supermodel and entrepreneur, David Gandy.","BBC Sounds - Rylan: How to Be..., Rylan: How to Be a Man, How to Be a Man: 7. David Gandy",,,,,"Rylan talks to male supermodel and entrepreneur, David Gandy.",en-GB
https://www.bbc.co.uk/programmes/a-z/by/a,1.411311053984576,transgender,webpage,"A list of available BBC television, radio and other programmes beginning with A.","BBC - Available Programmes - A to Z, A",,,,,"A list of available BBC television, radio and other programmes beginning with A.",en-GB
https://www.bbc.co.uk/programmes/a-z/by/a/player,1.411311053984576,transgender,webpage,"A list of available BBC television, radio and other programmes beginning with A.","BBC - Available Programmes - A to Z, A",,,,,"A list of available BBC television, radio and other programmes beginning with A.",en-GB
https://www.bbc.co.uk/programmes/m001yrzs/episodes/player,1.2191780821917808,gender-,webpage,Available episodes of Michael Spicer: No Room,BBC Radio 4 - Michael Spicer: No Room - Available now,,,,,Available episodes of Michael Spicer: No Room,en-GB
https://www.bbc.co.uk/programmes/m0018h15/episodes/player,2.381169324221716,"gender-, gender identity",webpage,Available episodes of AntiSocial,BBC Radio 4 - AntiSocial - Available now,,,,,Available episodes of AntiSocial,en-GB
https://www.bbc.co.uk/programmes/p07t5mp9,14.130669546436284,"gender-, transgender, gender identity, gender dysphoria",webpage,Caitlyn Jenner on why honesty is the key to peace of mind.,BBC - Caitlyn Jenner: Honesty,,,,,Caitlyn Jenner on why honesty is the key to peace of mind.,en-GB
https://www.bbc.co.uk/iplayer/episode/p07t5mp9,1.939015939015939,transgender,webpage,"The worlds most famous transgender woman, Caitlyn Jenner, explains why honesty is the key to peace of mind.",Caitlyn Jenner: Honesty - BBC iPlayer,,,,,"The world's most famous transgender woman, Caitlyn Jenner, explains why honesty is the key to peace of mind.",en-GB
https://www.bbc.co.uk/iplayer/episode/m00216mg,1,gender-,webpage,Daley Thompson takes an epic journey to tell the story of the complex man behind one of the greatest all-round athletes the world has ever seen.,Daley: Olympic Superstar - BBC iPlayer,,,,,Daley Thompson takes an epic journey to tell the story of the complex man behind one of the greatest all-round athletes the world has ever seen.,en-GB
https://www.bbc.co.uk/iplayer/episode/m00206t5,1,gender-,webpage,"A look at the life and career of the original Irish guitar hero, Rory Gallagher, featuring rare, never-before-seen archive footage and interviews with Rory’s closest friends and family.",The Rory Gallagher Story - BBC iPlayer,,,,,"A look at the life and career of the original Irish guitar hero, Rory Gallagher, featuring rare, never-before-seen archive footage and interviews with Rory’s closest friends and family.",en-GB
