URL,Score,Keywords Found,type_page,description,headline,datePublished,dateModified,author,byline,excerpt,lang
https://www.bbc.co.uk/news/technology-67359823,8.65956204379562,"non binary, gender-",webpage,Whitney Wolfe Herd is stepping down as chief executive at the end of the year after nearly a decade.,Whitney Wolfe Herd: How the Bumble boss changed the dating scene - BBC News,,,,Imran Rahman-Jones & Shiona McCallum,Whitney Wolfe Herd is stepping down as chief executive at the end of the year after nearly a decade.,en-GB
https://www.bbc.co.uk/news/world-us-canada-59495210,1,gender-,webpage,The court's eventual ruling may cut off abortion access for tens of millions of American women.,Supreme Court: Top US judges signal support for abortion limits - BBC News,,,,Holly Honderich,The court's eventual ruling may cut off abortion access for tens of millions of American women.,en-GB
https://www.bbc.co.uk/news/election-us-2020-54853289,1.4215262156082367,gender-,webpage,The US election sent a record number of women to Congress. Here's how the numbers break down.,Women continue to change the face of US politics - BBC News,,,,Lucy Rodgers,The US election sent a record number of women to Congress. Here's how the numbers break down.,en-GB
https://www.bbc.co.uk/news/election-us-2020-54854039,1.2590673575129534,transgender,webpage,From transgender State Senator Sarah McBride to 25-year-old Madison Cawthorn - here are some of the new faces making history in US politics.,US Election 2020: Meet five new faces making political history in the US - BBC News,,,,,From transgender State Senator Sarah McBride to 25-year-old Madison Cawthorn - here are some of the new faces making history in US politics.,en-GB
https://www.bbc.co.uk/news/election-us-2020-54700982,1,transgender,webpage,"A Republican, two Democrats and one independent voter react to her US Supreme Court confirmation.",US election 2020: LGBT voters on Amy Coney Barrett confirmation - BBC News,,,,BBC News,"A Republican, two Democrats and one independent voter react to her US Supreme Court confirmation.",en-GB
https://www.bbc.co.uk/news/articles/cgm7n0xgnzzo,1,transgender,webpage,"The former progressives have endorsed Trump, while a group of former Republicans has declared support for Kamala Harris. ",Trump adds ex-Democrats Gabbard and RFK Jr to his transition team - BBC News,,,,James FitzGerald and Mike Wendling,"The former progressives have endorsed Trump, while a group of former Republicans has declared support for Kamala Harris.",en-GB
https://www.bbc.co.uk/news/world-us-canada-47940659,1,gender-,webpage,"What's behind the surge in the US anti-abortion movement and their so-called ""heartbeat bills""?",What's going on in the fight over US abortion rights? - BBC News,,,,BBC News,"What's behind the surge in the US anti-abortion movement and their so-called ""heartbeat bills""?",en-GB
https://www.bbc.co.uk/news/world-us-canada-53357590,6.191597139451728,"gender-, transgender, gender identity",webpage,This court has been billed the most conservative in modern history. But does it vote that way?,Ruth Bader Ginsburg death: How has Trump's Supreme Court changed America? - BBC News,,,,BBC News,This court has been billed the most conservative in modern history. But does it vote that way?,en-GB
https://www.bbc.co.uk/news/world-us-canada-49488374,20.44203564210913,"gender-based, gender-",webpage,US Supreme Court Justice Ruth Bader Ginsburg was a trailblazer to women of all stripes.,Ruth Bader Ginsburg: Obituary of the Supreme Court justice - BBC News,,,,BBC News,US Supreme Court Justice Ruth Bader Ginsburg was a trailblazer to women of all stripes.,en-GB
https://www.bbc.co.uk/news/election-us-2020-54574584,22.507854751480814,gender-,webpage,What Kamala Harris' experiences tell us about US politics.,Kamala Harris: What her experience tells us about US politics - BBC News,,,,BBC News,What Kamala Harris' experiences tell us about US politics.,en-GB
https://www.bbc.co.uk/news/world-us-canada-54227286,3,gender-,webpage,The Democratic presidential nominee says it is wrong to replace Justice Ginsburg before the election.,"Ginsburg Supreme Court: Trump plan an abuse of power, says Biden - BBC News",,,,BBC News,The Democratic presidential nominee says it is wrong to replace Justice Ginsburg before the election.,en-GB
https://www.bbc.co.uk/news/world-us-canada-54289609,7.5404435746901495,gender-,webpage,Thousands have already paid their respects as she lay in repose outside the Supreme Court this week.,Ruth Bader Ginsburg becomes first woman to lie in state in US capitol - BBC News,,,,BBC News,Thousands have already paid their respects as she lay in repose outside the Supreme Court this week.,en-GB
https://www.bbc.co.uk/news/articles/c51nn66e415o,1,gender-,webpage,UK laws have changed to keep up with the science that shows it can be safe.,People with HIV can be sperm and egg donors - BBC News,,,,Michelle Roberts,UK laws have changed to keep up with the science that shows it can be safe.,en-GB
https://www.bbc.co.uk/news/topics/cwlw3xz0zxvt,3.150713907985193,adult human female,webpage,All the latest content about University of Edinburgh from the BBC.,University of Edinburgh - BBC News,,,,,All the latest content about University of Edinburgh from the BBC.,en-GB
https://www.bbc.co.uk/news/business-67236693,1.158168574401665,gender-,webpage,The bank's shares tumble after it lowers profit expectations and admits failings in how it treated Nigel Farage.,NatWest hit by profit fears as it admits Nigel Farage failings - BBC News,,,,Michael Race,The bank's shares tumble after it lowers profit expectations and admits failings in how it treated Nigel Farage.,en-GB
https://www.bbc.co.uk/programmes/p0hvtr32,3.810569663692519,gender-,webpage,We look at how entrenched sexist attitudes towards women are being tackled,"BBC World Service - People Fixing the World, Fighting sexism in society",,,,,We look at how entrenched sexist attitudes towards women are being tackled,en-GB
https://www.bbc.co.uk/news/uk-68300969,1.4829765545361875,transgender,webpage,The mother of murdered teenager Brianna says smartphone companies have a moral responsibility.,Brianna Ghey's mother Esther says Online Safety Act does not go far enough - BBC News,,,,James Gregory & Lou Newton,The mother of murdered teenager Brianna says smartphone companies have a moral responsibility.,en-GB
https://www.bbc.co.uk/sounds/play/p0d9ttgm,3,gender-,webpage,"Catch up on your favourite BBC radio show from your favourite DJ right here, whenever you like. Listen without limits with BBC Sounds.",The Story - Is Labour ready for power? - BBC Sounds,,,,,"With Labour riding high, Keir Starmer is calling for an early general election.",en-GB
https://www.bbc.co.uk/programmes/m001dwjn,2.515549412577747,trans issues,webpage,Is the controversial trade secretary and equalities minister a future PM?,"BBC Radio 4 - Profile, Kemi Badenoch",,,,,Is the controversial trade secretary and equalities minister a future PM?,en-GB
https://www.bbc.co.uk/news/articles/ce9p4d6xvl0o,1.2001721911321568,gender-,webpage,A senior Thames Valley officer responds to data showing force is used more against black people.,Thames Valley Police promises action plan over race statistics - BBC News,,,,BBC News,A senior Thames Valley officer responds to data showing force is used more against black people.,en-GB
https://www.bbc.co.uk/news/uk-england-hampshire-55586420,1,transgender,webpage,"Secret recordings revealed ""enough profanity, casual sexism and racism to last a lifetime"".",'Racist and sexist' Hampshire police unit officers dismissed - BBC News,,,,BBC News,"Secret recordings revealed ""enough profanity, casual sexism and racism to last a lifetime"".",en-GB
https://www.bbc.co.uk/sport/68239218,8.191319751992914,transgender,webpage,"Parkrun will no longer publish performance data on its website in order to be less ""off-putting"" to new entrants.",Parkrun removes data including speed records in order to be less 'off-putting',2024-02-08T16:38:43.000Z,2024-02-08T16:38:43.000Z,BBC Sport,BBC Sport,"Parkrun will no longer publish performance data on its website in order to be less ""off-putting"" to new entrants.",en-GB
https://www.bbc.co.uk/news/topics/cdl8n2edgegt,1.9446693657219973,gender-,webpage,All the latest content about Plaid Cymru from the BBC.,Plaid Cymru - BBC News,,,,,All the latest content about Plaid Cymru from the BBC.,en-GB
https://www.bbc.co.uk/news/uk-68582156,3,"gender critical, gender-",webpage,"Mr Gove says he was driven to action because the UK's values are ""under challenge"" from extremists.",Michael Gove: What are the hurdles facing his plans on extremism? - BBC News,,,,Dominic Casciani,"Mr Gove says he was driven to action because the UK's values are ""under challenge"" from extremists.",en-GB
https://www.bbc.co.uk/news/uk-politics-68556914,1,gender-,webpage,Groups falling under the new definition will be barred from government funding and meeting officials.,New extremism definition unveiled by government - BBC News,,,,"Sam Francis, political reporter & Christy Cooney",Groups falling under the new definition will be barred from government funding and meeting officials.,en-GB
https://www.bbc.co.uk/news/articles/c84975xgdwlo,6.587155963302752,"gender-, hilary cass, gender identity",webpage,New honours and peerages are announced just minutes before polls closed in the general election. ,Theresa May and 'bionic' MP Craig Mackinley awarded peerages - BBC News,,,,Kate Whannel,New honours and peerages are announced just minutes before polls closed in the general election.,en-GB
https://www.bbc.co.uk/news/articles/cx927ynl1yqo,4.313959804454101,gender-,webpage,The former MP says Nicola Sturgeon owes an apology to party members who lost their seats in the election.,Independence supporters 'disillusioned' with SNP - Joanna Cherry - BBC News,,,,Angus Cochrane,The former MP says Nicola Sturgeon owes an apology to party members who lost their seats in the election.,en-GB
https://www.bbc.co.uk/news/uk-scotland-scotland-politics-65110836,1,gender-,webpage,The new cabinet announced by John Swinney is the eighth since the SNP came to power in 2007.,In pictures: SNP cabinets down the years - BBC News,,,,BBC News,The new cabinet announced by John Swinney is the eighth since the SNP came to power in 2007.,en-GB
https://www.bbc.co.uk/news/articles/cevwdy7llrlo,1.038562874251497,gender-,webpage,"An ex-SNP deputy leader describes John Swinney's leadership as ""a busted flush"" and Nicola Sturgeon as ""Stalin's wee sister"".",What does 'Stalin' attack on Sturgeon's SNP mean for Swinney? - BBC News,,,,Lynsey Bews,"An ex-SNP deputy leader describes John Swinney's leadership as ""a busted flush"" and Nicola Sturgeon as ""Stalin's wee sister"".",en-GB
https://www.bbc.co.uk/news/uk-scotland-scotland-politics-68858376,12.528984156570363,"gender-, Cass Review, gender clinic, hilary cass, puberty blockers",webpage,"Ditched targets, attacks over puberty blockers and Peter Murrell charged: what comes next for the SNP?",Can the SNP catch a break after a bruising week? - BBC News,,,,David Wallace Lockhart,"Ditched targets, attacks over puberty blockers and Peter Murrell charged: what comes next for the SNP?",en-GB
https://www.bbc.co.uk/news/uk-politics-68912100,5.820356578650417,"gender-, trans people",webpage,"This ""OMG"" moment for Humza Yousaf is latest in a long line of nasty surprises for a party that has been in decline.","Humza Yousaf's job on the line and what happens next to the SNP matters across UK, writes Laura Kuenssberg - BBC News",,,,Laura Kuenssberg,"This ""OMG"" moment for Humza Yousaf is latest in a long line of nasty surprises for a party that has been in decline.",en-GB
https://www.bbc.co.uk/news/uk-scotland-68145298,1.866740947075209,gender-,webpage,Former Scottish First Minister Nicola Sturgeon is giving evidence to the UK Covid inquiry in Edinburgh.,Nicola Sturgeon's reputation on the line at UK Covid inquiry - BBC News,,,,James Cook,Former Scottish First Minister Nicola Sturgeon is giving evidence to the UK Covid inquiry in Edinburgh.,en-GB
https://www.bbc.co.uk/news/business-66086450,1,gender-,webpage,Big tech firms like IBM are no longer asking for degrees when hiring staff.,Do you need a degree to work in tech? - BBC News,,,,Sean McManus,Big tech firms like IBM are no longer asking for degrees when hiring staff.,en-GB
https://www.bbc.co.uk/news/world-europe-jersey-67366069,1.8787511367080933,"gender-based, gender-",webpage,The first report by the Taskforce for Violence Against Women and Girls has been published.,Report shows extent of violence against women in Jersey - BBC News,,,,Gemma Daubeney,The first report by the Taskforce for Violence Against Women and Girls has been published.,en-GB
https://www.bbc.co.uk/news/uk-england-beds-bucks-herts-68330442,1.06588693957115,LGBTQIA,webpage,"The Right Reverend Dr Alan Wilson is described as a ""dear friend"" who leaves an ""important legacy"".",Welby leads tributes as Bishop of Buckingham dies - BBC News,,,,Laura Devlin,"The Right Reverend Dr Alan Wilson is described as a ""dear friend"" who leaves an ""important legacy"".",en-GB
https://www.bbc.co.uk/news/articles/cqlv5e753xro,1,transgender,webpage,It is the second time the River De Lank at Delphy Bridge has been used for baptisms.,Outdoor river baptism on Bodmin Moor 'exhilarating'  - BBC News,,,,Christine Butler,It is the second time the River De Lank at Delphy Bridge has been used for baptisms.,en-GB
https://www.bbc.co.uk/news/articles/clyzk713072o,1,gender-,webpage,A crisis meeting was held after a Church committee failed to agree on two recent appointments.,Church same-sex split affecting bishop appointments - BBC News,,,,Aleem Maqbool,A crisis meeting was held after a Church committee failed to agree on two recent appointments.,en-GB
https://www.bbc.co.uk/programmes/p0cbg34g/episodes,2.0853658536585367,trans man,webpage,Available episodes of Different with Nicky Campbell,BBC Radio 5 Live - Different with Nicky Campbell - Available now,,,,,Available episodes of Different with Nicky Campbell,en-GB
https://www.bbc.co.uk/news/uk-scotland-64796926,40.15839564921822,"trans people, transgender, gender-, trans woman",webpage,The case sparked a heated debate over whether Bryson should be held in a male or a female prison.,Isla Bryson: Transgender rapist jailed for eight years - BBC News,,,,BBC News,The case sparked a heated debate over whether Bryson should be held in a male or a female prison.,en-GB
https://www.bbc.co.uk/news/uk-politics-66999209,3,gender-,webpage,The home secretary pledges tougher action on small boats in a hard-hitting Tory conference speech.,Suella Braverman: We've been too squeamish on migration - BBC News,,,,Paul Seddon,The home secretary pledges tougher action on small boats in a hard-hitting Tory conference speech.,en-GB
https://www.bbc.co.uk/news/health-66994133,45.56337495270526,"sex matters, gender-, trans people, single sex spaces, transgender",webpage,"Health Secretary promises consultation on NHS constitution, calling for a ""common-sense"" approach.",Trans women may be banned from women's NHS wards - BBC News,,,,BBC News,"Health Secretary promises consultation on NHS constitution, calling for a ""common-sense"" approach.",en-GB
https://www.bbc.co.uk/news/uk-politics-66998189,4.7995802728226655,gender-,webpage,Andrew Boff has his pass removed after objecting to the home secretary's comments on gender.,Tory politician Andrew Boff kicked out of conference after Braverman heckle - BBC News,,,,Kate Whannel,Andrew Boff has his pass removed after objecting to the home secretary's comments on gender.,en-GB
https://www.bbc.co.uk/iplayer/episode/b07yc9zh,2.540295804406882,"transgender, gender-, gender dysphoria",webpage,Louis Theroux sets out to understand how a man at the centre of British entertainment and charitable fundraising for decades was able to get away with a long litany of crimes.,Louis Theroux Specials - Savile - BBC iPlayer,,,,,Louis Theroux sets out to understand how a man at the centre of British entertainment and charitable fundraising for decades was able to get away with a long litany of crimes.,gd-GB
https://www.bbc.co.uk/sounds/play/p075zdyy,1,transgender,webpage,"Catch up on your favourite BBC radio show from your favourite DJ right here, whenever you like. Listen without limits with BBC Sounds.",Beyond Today - How did a teenager become the UK’s biggest cyber criminal? - BBC Sounds,,,,,Zain Qaiser made hundreds of thousands blackmailing porn users from his parents’ house.,en-GB
https://www.bbc.co.uk/news/articles/cnl08r4404po,1,gender-,webpage,As polling day approaches the leaders have been travelling the country in a bid to win votes.,General election 2024: Parties stress core messages as election nears - BBC News,,,,Paul Seddon,As polling day approaches the leaders have been travelling the country in a bid to win votes.,en-GB
https://www.bbc.co.uk/news/articles/cd1100epn90o,7,"trans issues, trans rights, single sex spaces",webpage,The gloves were off as Rishi Sunak and Sir Keir Starmer went head-to-head in the final TV debate of the election between the leaders.,Six key takeaways from the last TV leadership debate - BBC News,,,,Jennifer McKiernan,The gloves were off as Rishi Sunak and Sir Keir Starmer went head-to-head in the final TV debate of the election between the leaders.,en-GB
https://www.bbc.co.uk/news/topics/cmmqq9k8ymkt,1.6354799513973268,transgender,webpage,All the latest content about Electoral Commission  from the BBC.,Electoral Commission  - BBC News,,,,,All the latest content about Electoral Commission  from the BBC.,en-GB
https://www.bbc.co.uk/news/articles/c880m348v7mo,1.042593769866497,gender-,webpage,Riders are cycling from Cleckheaton to London to raise funds for the murdered MP's charity.,"Jo Cox cycle ride 'inspirational', says sister Kim Leadbeater - BBC News",,,,BBC News,Riders are cycling from Cleckheaton to London to raise funds for the murdered MP's charity.,en-GB
https://www.bbc.co.uk/news/uk-england-manchester-68244908,1.0991803278688526,transphobic,webpage,A Lancashire man is jailed for two years and eight months for glorifying the murder on social media.,Lancashire army veteran jailed for glorifying Jo Cox killer - BBC News,,,,BBC News,A Lancashire man is jailed for two years and eight months for glorifying the murder on social media.,en-GB
https://www.bbc.co.uk/news/uk-44844335,10.69083359948898,gender-,webpage,"They are challenging an ""outdated"" law that stops them being elected to the Lords because of their gender.",Daughters in legal bid for House of Lords seat rights - BBC News,,,,BBC News,"They are challenging an ""outdated"" law that stops them being elected to the Lords because of their gender.",en-GB
https://www.bbc.co.uk/news/world-europe-65137156,1.0310133429498738,gender-,webpage,The Dutch government is hosting 900 migrants and asylum seekers on the Silja Europa passenger ship.,The ferry in the Netherlands hosting refugees and migrants - BBC News,,,,Nick Beake,The Dutch government is hosting 900 migrants and asylum seekers on the Silja Europa passenger ship.,en-GB
https://www.bbc.co.uk/news/uk-politics-67420331,3,single sex spaces,webpage,The former home secretary criticises Rishi Sunak's leadership ahead of a ruling on the government's Rwanda plan.,Suella Braverman accuses Rishi Sunak of betrayal in scathing letter - BBC News,,,,Becky Morton & Paul Seddon,The former home secretary criticises Rishi Sunak's leadership ahead of a ruling on the government's Rwanda plan.,en-GB
https://www.bbc.co.uk/cbbc/joinin/500-words-privacy-notice,3.3367222448149656,gender-,webpage,Check out the Privacy notice for the 500 words competition.,500 Words 2024: Privacy Notice - CBBC,,,,,Check out the Privacy notice for the 500 words competition.,en-GB
https://www.bbc.co.uk/cbbc/games/jamie-johnson-fc-hawx-academy-game,1.3760886777513857,gender-,webpage,"Have you got what it takes to become the star player of HAWX Academy. In this game you will be challenged to complete training sessions, make difficult decisions that could affect teammates and prove your skills to the team on match days.",JJFC: HAWX Academy - CBBC,,,,,"Have you got what it takes to become the star player of HAWX Academy. In this game you will be challenged to complete training sessions, make difficult decisions that could affect teammates and prove your skills to the team on match days.",en-GB
https://www.bbc.co.uk/cbeebies/grownups/faqs#apps,4.884605138885526,gender-,webpage,"Got a question about anything on CBeebies? From how to watch the panto to sending in a birthday card, you'll find the answers here.",Frequently asked questions - CBeebies,,,,,"Got a question about anything on CBeebies? From how to watch the panto to sending in a birthday card, you'll find the answers here.",en-GB
https://www.bbc.co.uk/bitesize/articles/zdrk7v4#zbx4239,1,gender-,webpage,"Free Bitesize podcasts to help you revise for your GCSE exams from BBC Bitesize and BBC Sounds, covering Biology, Chemistry, Physics, English Literature and Study Support",Podcasts for GCSE revision from BBC Bitesize and BBC Sounds - BBC Bitesize,2023-03-10T09:35:23.000Z,2024-05-21T14:59:39.588Z,BBC Bitesize,BBC Bitesize,"Free Bitesize podcasts to help you revise for your GCSE exams from BBC Bitesize and BBC Sounds, covering Biology, Chemistry, Physics, English Literature and Study Support",gd
https://www.bbc.co.uk/bitesize/articles/zdrk7v4#zj4dmbk,1,gender-,webpage,"Free Bitesize podcasts to help you revise for your GCSE exams from BBC Bitesize and BBC Sounds, covering Biology, Chemistry, Physics, English Literature and Study Support",Podcasts for GCSE revision from BBC Bitesize and BBC Sounds - BBC Bitesize,2023-03-10T09:35:23.000Z,2024-05-21T14:59:39.588Z,BBC Bitesize,BBC Bitesize,"Free Bitesize podcasts to help you revise for your GCSE exams from BBC Bitesize and BBC Sounds, covering Biology, Chemistry, Physics, English Literature and Study Support",gd
https://www.bbc.co.uk/bitesize/articles/zdrk7v4#zbhs46f,1,gender-,webpage,"Free Bitesize podcasts to help you revise for your GCSE exams from BBC Bitesize and BBC Sounds, covering Biology, Chemistry, Physics, English Literature and Study Support",Podcasts for GCSE revision from BBC Bitesize and BBC Sounds - BBC Bitesize,2023-03-10T09:35:23.000Z,2024-05-21T14:59:39.588Z,BBC Bitesize,BBC Bitesize,"Free Bitesize podcasts to help you revise for your GCSE exams from BBC Bitesize and BBC Sounds, covering Biology, Chemistry, Physics, English Literature and Study Support",gd
https://www.bbc.co.uk/bitesize/articles/zdrk7v4#z2w2p9q,1,gender-,webpage,"Free Bitesize podcasts to help you revise for your GCSE exams from BBC Bitesize and BBC Sounds, covering Biology, Chemistry, Physics, English Literature and Study Support",Podcasts for GCSE revision from BBC Bitesize and BBC Sounds - BBC Bitesize,2023-03-10T09:35:23.000Z,2024-05-21T14:59:39.588Z,BBC Bitesize,BBC Bitesize,"Free Bitesize podcasts to help you revise for your GCSE exams from BBC Bitesize and BBC Sounds, covering Biology, Chemistry, Physics, English Literature and Study Support",gd
https://www.bbc.co.uk/cbeebies/grownups/faqs,4.884605138885526,gender-,webpage,"Got a question about anything on CBeebies? From how to watch the panto to sending in a birthday card, you'll find the answers here.",Frequently asked questions - CBeebies,,,,,"Got a question about anything on CBeebies? From how to watch the panto to sending in a birthday card, you'll find the answers here.",en-GB
https://www.bbc.co.uk/bitesize/articles/zw8qpbk#zjhbr2p,1,gender-,webpage,Smart revision and exam advice for your GCSE or National exams from students.,Top revision techniques for exams - BBC Bitesize,2019-10-31T17:30:12.000Z,2024-05-21T15:12:47.023Z,BBC Bitesize,BBC Bitesize,Smart revision and exam advice for your GCSE or National exams from students.,gd
https://www.bbc.co.uk/bitesize/articles/zdrk7v4#zcb4jfr,1,gender-,webpage,"Free Bitesize podcasts to help you revise for your GCSE exams from BBC Bitesize and BBC Sounds, covering Biology, Chemistry, Physics, English Literature and Study Support",Podcasts for GCSE revision from BBC Bitesize and BBC Sounds - BBC Bitesize,2023-03-10T09:35:23.000Z,2024-05-21T14:59:39.588Z,BBC Bitesize,BBC Bitesize,"Free Bitesize podcasts to help you revise for your GCSE exams from BBC Bitesize and BBC Sounds, covering Biology, Chemistry, Physics, English Literature and Study Support",gd
https://www.bbc.co.uk/iplayer/episode/m0023v4q,1.1658063183976874,gender-,webpage,"Stephen Sackur speaks to Tamir Pardo, former director of the Israeli intelligence agency Mossad. He was appointed by Benjamin Netanyahu but now he’s a fierce critic of the Israeli prime minister. ",HARDtalk - Tamir Pardo - Former Mossad Director - BBC iPlayer,,,,,"Stephen Sackur speaks to Tamir Pardo, former director of the Israeli intelligence agency Mossad. He was appointed by Benjamin Netanyahu but now he’s a fierce critic of the Israeli prime minister.",gd-GB
https://www.bbc.co.uk/iplayer/episode/m0023try,1.1655656482246077,gender-,webpage,"Allan Little speaks to Kim Aris, the son of the ousted civilian leader of Myanmar, Aung San Suu Kyi. Now a political prisoner, what is her fate and that of the country she left her family to serve?",HARDtalk - Kim Aris - Son of Aung San Suu Kyi - BBC iPlayer,,,,,"Allan Little speaks to Kim Aris, the son of the ousted civilian leader of Myanmar, Aung San Suu Kyi. Now a political prisoner, what is her fate and that of the country she left her family to serve?",gd-GB
